Extracted contents:
header:          00 ff ff ff ff ff ff 00
serial number:   41 0c e1 08 35 00 00 00 2a 19
version:         01 04
basic params:    a5 58 31 78 3a
chroma info:     f6 3d a3 55 4e 9e 27 0d 47 4a
established:     bd 4b 00
standard:        d1 c0 81 80 81 40 95 0f 95 00 b3 00 81 c0 01 01
descriptor 1:    4d d0 00 a0 f0 70 3e 80 30 20 35 00 6e e5 31 00 00 1a
descriptor 2:    04 74 00 30 f2 70 5a 80 b0 58 8a 00 6e e5 31 00 00 1a
descriptor 3:    00 00 00 fc 00 50 48 4c 20 42 44 4d 34 30 36 35 0a 20
descriptor 4:    00 00 00 fd 00 17 50 1e a0 3c 01 0a 20 20 20 20 20 20
extensions:      01
checksum:        05

Manufacturer: PHL Model 8e1 Serial Number 53
Made week 42 of 2015
EDID version: 1.4
Digital display
8 bits per primary color channel
DisplayPort interface
Maximum image size: 88 cm x 49 cm
Gamma: 2.20
DPMS levels: Off
Supported color formats: RGB 4:4:4, YCrCb 4:4:4, YCrCb 4:2:2
First detailed timing is preferred timing
Established timings supported:
  720x400@70Hz
  640x480@60Hz
  640x480@67Hz
  640x480@72Hz
  640x480@75Hz
  800x600@60Hz
  800x600@75Hz
  1024x768@60Hz
  1024x768@75Hz
  1280x1024@75Hz
Standard timings supported:
  1920x1080@60Hz
  1280x1024@60Hz
  1280x960@60Hz
  1440x900@75Hz
  1440x900@60Hz
  1680x1050@60Hz
  1280x720@60Hz
Detailed mode: Clock 533.250 MHz, 878 mm x 485 mm
               3840 3888 3920 4000 hborder 0
               2160 2163 2168 2222 vborder 0
               +hsync -vsync 
Detailed mode: Clock 297.000 MHz, 878 mm x 485 mm
               3840 4016 4104 4400 hborder 0
               2160 2168 2178 2250 vborder 0
               +hsync -vsync 
Monitor name: PHL
Monitor ranges (bare limits): 23-80Hz V, 30-160kHz H, max dotclock 600MHz
Has 1 extension blocks
Checksum: 0x5 (valid)

CEA extension block
Extension version: 3
26 bytes of CEA data
  Video data block
    VIC  16 1920x1080@60Hz 
    VIC  31 1920x1080@50Hz 
    VIC   4 1280x720@60Hz 
    VIC  19 1280x720@50Hz 
    VIC   3 720x480@60Hz 
    VIC  18 720x576@50Hz 
    VIC   2 720x480@60Hz 
    VIC  17 720x576@50Hz 
    VIC   1 640x480@60Hz 
    VIC   5 1920x1080i@60Hz 
    VIC  20 1920x1080i@50Hz 
  Audio data block
    Linear PCM, max channels 2
    Supported sample rates (kHz): 48 44.1 32
    Supported sample sizes (bits): 24 20 16
  Speaker allocation data block
    Speaker map: FL/FR
  Vendor-specific data block, OUI 000c03 (HDMI)
    Source physical address 1.0.0.0
Underscans PC formats by default
Basic audio support
Supports YCbCr 4:4:4
Supports YCbCr 4:2:2
1 native detailed modes
Detailed mode: Clock 262.750 MHz, 878 mm x 485 mm
               3840 3888 3920 4000 hborder 0
               2160 2163 2168 2191 vborder 0
               +hsync -vsync 
Detailed mode: Clock 241.500 MHz, 878 mm x 485 mm
               2560 2608 2640 2720 hborder 0
               1440 1443 1448 1481 vborder 0
               +hsync -vsync 
Detailed mode: Clock 209.750 MHz, 878 mm x 485 mm
               3840 3888 3920 4000 hborder 0
               2160 2163 2168 2185 vborder 0
               +hsync -vsync 
Detailed mode: Clock 147.170 MHz, 878 mm x 485 mm
               2048 2096 2128 2208 hborder 0
               1080 1083 1093 1111 vborder 0
               +hsync -vsync 
Checksum: 0x4b (valid)

EDID block does NOT conform to EDID 1.3!
	Detailed block string not properly terminated
